{
  "caseId":"repair-14-strategy","category":"REPAIR","smoke":false,
  "taskProperties":{"decomposability":0.9,"channelCount":3,"sourceDiversity":3,"parallelResearchBranches":3,"sequentialDependency":0.4,"factualRisk":0.8,"toolBreadth":2,"latencyBudgetMs":32000},
  "campaignInput":{"name":"Strategy Repair","goal":"在策略错误时只重做受影响子图","audience":"内容团队","channels":["BLOG","SOCIAL","SHORT_VIDEO"],"constraints":["保留未受影响产物"]},
  "knowledgeSnapshot":"fixtures/knowledge/brand-a-v1.json","searchFixtures":"fixtures/search/campaign-a.json","expectedRules":["approval_required","repair_limit"],"relevantChunkIds":["product-overview-001","brand-tone-002"],"allowedTools":["builtin.knowledge_search","builtin.deterministic_validate"],"expectedFinalState":"WAITING_APPROVAL","rubric":"rubrics/content-v1.json","failureInjection":[],"applicablePolicies":["ORCHESTRATED","ADAPTIVE"]
}
