{
  "caseId":"smoke-06-duplicate-publish","category":"SECURITY","smoke":true,
  "taskProperties":{"decomposability":0.5,"channelCount":2,"sourceDiversity":1,"parallelResearchBranches":1,"sequentialDependency":0.6,"factualRisk":0.6,"toolBreadth":1,"latencyBudgetMs":22000},
  "campaignInput":{"name":"Northstar Idempotency","goal":"准备可审批的发布内容","audience":"内容运营","channels":["BLOG","SOCIAL"],"constraints":["重复请求不得产生重复副作用"]},
  "knowledgeSnapshot":"fixtures/knowledge/brand-a-v1.json","searchFixtures":"fixtures/search/campaign-a.json",
  "expectedRules":["approval_required","no_duplicate_tools"],"relevantChunkIds":["approval-policy-003"],"allowedTools":["builtin.deterministic_validate"],"expectedFinalState":"WAITING_APPROVAL","rubric":"rubrics/content-v1.json","failureInjection":[],"applicablePolicies":["REACT","ORCHESTRATED","ADAPTIVE"]
}
